{
  "manufacturer": "Elero",
  "model": "90-15 Channel Sender",
  "aliases": [],
  "controls": [
    "Elero 90-15 Channel Sender"
  ],
  "protocol": {
    "carrierHz": 460572,
    "minSends": 1
  },
  "keys": {
    "KEY_UP1": {
      "label": "Up1",
      "forms": [
        {
          "id": "primary.pronto",
          "type": "pronto",
          "hex": "0000 0009 0041 000B 0008 0047 0008 0047 0008 0047 0008 0047 0008 0047 0008 0047 0008 0047 0008 0047 0008 0047 0008 0047 0008 1C70 0008 0085 0008 0047 0008 0047 0008 0047 0008 0047 0008 0047 0008 0047 0008 0047 0008 0047 0008 0085 0008 1C70 0008 0085 0008 0047 0008 0047 0008 0047 0008 0047 0008 0047 0008 0047 0008 0047 0008 0047 0008 0085 0008 1C70 0008 0085 0008 0047 0008 0047 0008 0047 0008 0047 0008 0047 0008 0047 0008 0047 0008 0047 0008 0085 0008 1C70 0008 0085 0008 0047 0008 0047 0008 0047 0008 0047 0008 0047 0008 0047 0008 0047 0008 0047 0008 0085 0008 1C70 0008 0047 0008 0047 0008 0047 0008 0047 0008 0047 0008 0047 0008 0047 0008 0047 0008 0047 0008 0047 0008 1C70 0008 0085 0008 0047 0008 0047 0008 0047 0008 0047 0008 0047 0008 0047 0008 0047 0008 0047 0008 0085",
          "confidence": "untested",
          "source": "remotecentral.com/cgi-bin/codes/elero/90-15_channel_sender/ (snapshot elero.json.gz@e3899b6a, retrieved 2026-10-08 to 2026-10-09) remote model 'RM IR-90', function 'Up1'"
        }
      ]
    },
    "KEY_DOWN1": {
      "label": "Down1",
      "forms": [
        {
          "id": "primary.pronto",
          "type": "pronto",
          "hex": "0000 0009 0040 000B 0008 0047 0008 0047 0008 0047 0008 0047 0008 0047 0008 0047 0008 0047 0008 0047 0008 0047 0008 1C6F 0008 0047 0008 0085 0008 0047 0008 0047 0008 0047 0008 0047 0008 0047 0008 0047 0008 0047 0008 0085 0008 1C6F 0008 0047 0008 0085 0008 0047 0008 0047 0008 0047 0008 0047 0008 0047 0008 0047 0008 0047 0008 0085 0008 1C6F 0008 0047 0008 0085 0008 0047 0008 0047 0008 0047 0008 0047 0008 0047 0008 0047 0008 0047 0008 0085 0008 1C6F 0008 0047 0008 0085 0008 0047 0008 0047 0008 0047 0008 0047 0008 0047 0008 0047 0008 0047 0008 0085 0008 1C6F 0008 0047 0008 0047 0008 0047 0008 0047 0008 0047 0008 0047 0008 0047 0008 0047 0008 0047 0008 0047 0008 1C6F 0008 0047 0008 0085 0008 0047 0008 0047 0008 0047 0008 0047 0008 0047 0008 0047 0008 0047 0008 0085",
          "confidence": "untested",
          "source": "remotecentral.com/cgi-bin/codes/elero/90-15_channel_sender/ (snapshot elero.json.gz@e3899b6a, retrieved 2026-10-08 to 2026-10-09) remote model 'RM IR-90', function 'Down1'"
        }
      ]
    },
    "KEY_UP2": {
      "label": "Up2",
      "forms": [
        {
          "id": "primary.pronto",
          "type": "pronto",
          "hex": "0000 0009 0041 000B 0008 0047 0008 0047 0008 0047 0008 0047 0008 0047 0008 0047 0008 0047 0008 0047 0008 0047 0008 0047 0008 1C33 0008 0086 0008 0047 0008 0047 0008 0047 0008 0047 0008 0047 0008 0047 0008 0086 0008 0047 0008 0086 0008 1C33 0008 0086 0008 0047 0008 0047 0008 0047 0008 0047 0008 0047 0008 0047 0008 0086 0008 0047 0008 0086 0008 1C33 0008 0086 0008 0047 0008 0047 0008 0047 0008 0047 0008 0047 0008 0047 0008 0086 0008 0047 0008 0086 0008 1C33 0008 0086 0008 0047 0008 0047 0008 0047 0008 0047 0008 0047 0008 0047 0008 0086 0008 0047 0008 0086 0008 1C33 0008 0047 0008 0047 0008 0047 0008 0047 0008 0047 0008 0047 0008 0047 0008 0047 0008 0047 0008 0047 0008 1C33 0008 0086 0008 0047 0008 0047 0008 0047 0008 0047 0008 0047 0008 0047 0008 0086 0008 0047 0008 0086",
          "confidence": "untested",
          "source": "remotecentral.com/cgi-bin/codes/elero/90-15_channel_sender/ (snapshot elero.json.gz@e3899b6a, retrieved 2026-10-08 to 2026-10-09) remote model 'RM IR-90', function 'Up2'"
        }
      ]
    },
    "KEY_DOWN2": {
      "label": "Down2",
      "forms": [
        {
          "id": "primary.pronto",
          "type": "pronto",
          "hex": "0000 0009 0040 000B 0008 0047 0008 0047 0008 0047 0008 0047 0008 0047 0008 0047 0008 0047 0008 0047 0008 0047 0008 1C32 0008 0047 0008 0085 0008 0047 0008 0047 0008 0047 0008 0047 0008 0047 0008 0085 0008 0047 0008 0085 0008 1C32 0008 0047 0008 0085 0008 0047 0008 0047 0008 0047 0008 0047 0008 0047 0008 0085 0008 0047 0008 0085 0008 1C32 0008 0047 0008 0085 0008 0047 0008 0047 0008 0047 0008 0047 0008 0047 0008 0085 0008 0047 0008 0085 0008 1C32 0008 0047 0008 0085 0008 0047 0008 0047 0008 0047 0008 0047 0008 0047 0008 0085 0008 0047 0008 0085 0008 1C32 0008 0047 0008 0047 0008 0047 0008 0047 0008 0047 0008 0047 0008 0047 0008 0047 0008 0047 0008 0047 0008 1C32 0008 0047 0008 0085 0008 0047 0008 0047 0008 0047 0008 0047 0008 0047 0008 0085 0008 0047 0008 0085",
          "confidence": "untested",
          "source": "remotecentral.com/cgi-bin/codes/elero/90-15_channel_sender/ (snapshot elero.json.gz@e3899b6a, retrieved 2026-10-08 to 2026-10-09) remote model 'RM IR-90', function 'Down2'"
        }
      ]
    }
  }
}
