{
  "manufacturer": "KENWOOD",
  "model": "IR Blaster DB 7404 (NEC1)",
  "aliases": [],
  "controls": [
    "KENWOOD | R-K711",
    "KENWOOD | RC-RP0705",
    "KENWOOD | RC-RP0705E"
  ],
  "protocol": {
    "name": "NEC1",
    "carrierHz": 38400,
    "minSends": 1
  },
  "keys": {
    "KEY_0": {
      "label": "0",
      "forms": [
        {
          "id": "primary.irp",
          "type": "irp",
          "device": "0xB8",
          "subdevice": "0x00",
          "function": "0x80",
          "confidence": "plausible",
          "source": "irblaster-db@6aafd15 remote 7404, '0' 1D0001FE NEC: 32 wire bits, bytes bit-reversed as NEC1"
        }
      ]
    },
    "KEY_1": {
      "label": "1",
      "forms": [
        {
          "id": "primary.irp",
          "type": "irp",
          "device": "0xB8",
          "subdevice": "0x00",
          "function": "0x81",
          "confidence": "plausible",
          "source": "irblaster-db@6aafd15 remote 7404, '1' 1D00817E NEC: 32 wire bits, bytes bit-reversed as NEC1"
        }
      ]
    },
    "KEY_2": {
      "label": "2",
      "forms": [
        {
          "id": "primary.irp",
          "type": "irp",
          "device": "0xB8",
          "subdevice": "0x00",
          "function": "0x82",
          "confidence": "plausible",
          "source": "irblaster-db@6aafd15 remote 7404, '2' 1D0041BE NEC: 32 wire bits, bytes bit-reversed as NEC1"
        }
      ]
    },
    "KEY_3": {
      "label": "3",
      "forms": [
        {
          "id": "primary.irp",
          "type": "irp",
          "device": "0xB8",
          "subdevice": "0x00",
          "function": "0x83",
          "confidence": "plausible",
          "source": "irblaster-db@6aafd15 remote 7404, '3' 1D00C13E NEC: 32 wire bits, bytes bit-reversed as NEC1"
        }
      ]
    },
    "KEY_4": {
      "label": "4",
      "forms": [
        {
          "id": "primary.irp",
          "type": "irp",
          "device": "0xB8",
          "subdevice": "0x00",
          "function": "0x84",
          "confidence": "plausible",
          "source": "irblaster-db@6aafd15 remote 7404, '4' 1D0021DE NEC: 32 wire bits, bytes bit-reversed as NEC1"
        }
      ]
    },
    "KEY_5": {
      "label": "5",
      "forms": [
        {
          "id": "primary.irp",
          "type": "irp",
          "device": "0xB8",
          "subdevice": "0x00",
          "function": "0x85",
          "confidence": "plausible",
          "source": "irblaster-db@6aafd15 remote 7404, '5' 1D00A15E NEC: 32 wire bits, bytes bit-reversed as NEC1"
        }
      ]
    },
    "KEY_6": {
      "label": "6",
      "forms": [
        {
          "id": "primary.irp",
          "type": "irp",
          "device": "0xB8",
          "subdevice": "0x00",
          "function": "0x86",
          "confidence": "plausible",
          "source": "irblaster-db@6aafd15 remote 7404, '6' 1D00619E NEC: 32 wire bits, bytes bit-reversed as NEC1"
        }
      ]
    },
    "KEY_7": {
      "label": "7",
      "forms": [
        {
          "id": "primary.irp",
          "type": "irp",
          "device": "0xB8",
          "subdevice": "0x00",
          "function": "0x87",
          "confidence": "plausible",
          "source": "irblaster-db@6aafd15 remote 7404, '7' 1D00E11E NEC: 32 wire bits, bytes bit-reversed as NEC1"
        }
      ]
    },
    "KEY_8": {
      "label": "8",
      "forms": [
        {
          "id": "primary.irp",
          "type": "irp",
          "device": "0xB8",
          "subdevice": "0x00",
          "function": "0x88",
          "confidence": "plausible",
          "source": "irblaster-db@6aafd15 remote 7404, '8' 1D0011EE NEC: 32 wire bits, bytes bit-reversed as NEC1"
        }
      ]
    },
    "KEY_9": {
      "label": "9",
      "forms": [
        {
          "id": "primary.irp",
          "type": "irp",
          "device": "0xB8",
          "subdevice": "0x00",
          "function": "0x89",
          "confidence": "plausible",
          "source": "irblaster-db@6aafd15 remote 7404, '9' 1D00916E NEC: 32 wire bits, bytes bit-reversed as NEC1"
        }
      ]
    },
    "KEY_MUTE": {
      "label": "MUTE",
      "forms": [
        {
          "id": "primary.irp",
          "type": "irp",
          "device": "0xB8",
          "subdevice": "0x00",
          "function": "0x9C",
          "confidence": "plausible",
          "source": "irblaster-db@6aafd15 remote 7404, 'MUTE' 1D0039C6 NEC: 32 wire bits, bytes bit-reversed as NEC1"
        }
      ]
    },
    "KEY_STOP": {
      "label": "STOP",
      "forms": [
        {
          "id": "primary.irp",
          "type": "irp",
          "device": "0xB8",
          "subdevice": "0x02",
          "function": "0x04",
          "confidence": "plausible",
          "source": "irblaster-db@6aafd15 remote 7404, 'STOP' 1D4020DF NEC: 32 wire bits, bytes bit-reversed as NEC1"
        }
      ]
    },
    "KEY_VOL_MINUS": {
      "label": "VOL-",
      "forms": [
        {
          "id": "primary.irp",
          "type": "irp",
          "device": "0xB8",
          "subdevice": "0x00",
          "function": "0x9A",
          "confidence": "plausible",
          "source": "irblaster-db@6aafd15 remote 7404, 'VOL-' 1D0059A6 NEC: 32 wire bits, bytes bit-reversed as NEC1"
        }
      ]
    },
    "KEY_VOL_PLUS": {
      "label": "VOL+",
      "forms": [
        {
          "id": "primary.irp",
          "type": "irp",
          "device": "0xB8",
          "subdevice": "0x00",
          "function": "0x9B",
          "confidence": "plausible",
          "source": "irblaster-db@6aafd15 remote 7404, 'VOL+' 1D00D926 NEC: 32 wire bits, bytes bit-reversed as NEC1"
        }
      ]
    },
    "KEY__1D4040BF": {
      "label": "⏪",
      "forms": [
        {
          "id": "primary.irp",
          "type": "irp",
          "device": "0xB8",
          "subdevice": "0x02",
          "function": "0x02",
          "confidence": "plausible",
          "source": "irblaster-db@6aafd15 remote 7404, '⏪' 1D4040BF NEC: 32 wire bits, bytes bit-reversed as NEC1"
        }
      ]
    },
    "KEY__1D40C03F": {
      "label": "⏩",
      "forms": [
        {
          "id": "primary.irp",
          "type": "irp",
          "device": "0xB8",
          "subdevice": "0x02",
          "function": "0x03",
          "confidence": "plausible",
          "source": "irblaster-db@6aafd15 remote 7404, '⏩' 1D40C03F NEC: 32 wire bits, bytes bit-reversed as NEC1"
        }
      ]
    }
  }
}
