{
  "manufacturer": "sony",
  "model": "RM-U25 [Sony_RM-U25_Mute]",
  "aliases": [],
  "controls": [
    "This is the configuration programmin the \"2\" preset"
  ],
  "protocol": {
    "carrierHz": 38000,
    "minSends": 1
  },
  "keys": {
    "KEY_MUTE": {
      "forms": [
        {
          "id": "primary.raw",
          "type": "raw",
          "repeat": [2550, 523, 690, 523, 690, 523, 1262, 523, 690, 523, 1262, 523, 690, 523, 690, 523, 690, 523, 690, 523, 690, 523, 690, 523, 1262, 523, 690, 523, 1262, 523, 690, 24393],
          "confidence": "plausible",
          "source": "lirc-remotes@291b40f remotes/sony/RM-U25.lircd.conf:157 [block Sony_RM-U25_Mute]: expanded to raw by lircd 0.10.2's transmit rules; carrier: lircd's default 38 kHz, the block sets none"
        }
      ]
    }
  }
}
