{
  "manufacturer": "LG",
  "model": "IR Blaster DB 7264 (RC5)",
  "aliases": [],
  "controls": [
    "LG | 6710CDAT09H"
  ],
  "protocol": {
    "name": "RC5",
    "carrierHz": 36000,
    "minSends": 1
  },
  "keys": {
    "KEY_TV_CHANNEL_MINUS": {
      "label": "TV CHANNEL -",
      "forms": [
        {
          "id": "primary.irp",
          "type": "irp",
          "device": "0x00",
          "function": "0x21",
          "confidence": "plausible",
          "source": "irblaster-db@6aafd15 remote 7264, 'TV CHANNEL -' 821 RC5: 12 bits, start bit inverted into F as RC5"
        }
      ]
    },
    "KEY_TV_CHANNEL_PLUS": {
      "label": "TV CHANNEL +",
      "forms": [
        {
          "id": "primary.irp",
          "type": "irp",
          "device": "0x00",
          "function": "0x20",
          "confidence": "plausible",
          "source": "irblaster-db@6aafd15 remote 7264, 'TV CHANNEL +' 820 RC5: 12 bits, start bit inverted into F as RC5"
        }
      ]
    },
    "KEY_TV_INPUT": {
      "label": "TV INPUT",
      "forms": [
        {
          "id": "primary.irp",
          "type": "irp",
          "device": "0x00",
          "function": "0x38",
          "confidence": "plausible",
          "source": "irblaster-db@6aafd15 remote 7264, 'TV INPUT' 838 RC5: 12 bits, start bit inverted into F as RC5"
        }
      ]
    },
    "KEY_TV_MUTE": {
      "label": "TV MUTE",
      "forms": [
        {
          "id": "primary.irp",
          "type": "irp",
          "device": "0x00",
          "function": "0x0D",
          "confidence": "plausible",
          "source": "irblaster-db@6aafd15 remote 7264, 'TV MUTE' 80D RC5: 12 bits, start bit inverted into F as RC5"
        }
      ]
    },
    "KEY_TV_POWER": {
      "label": "TV POWER",
      "forms": [
        {
          "id": "primary.irp",
          "type": "irp",
          "device": "0x00",
          "function": "0x0C",
          "confidence": "plausible",
          "source": "irblaster-db@6aafd15 remote 7264, 'TV POWER' 80C RC5: 12 bits, start bit inverted into F as RC5"
        }
      ]
    },
    "KEY_TV_VOL_MINUS": {
      "label": "TV VOL -",
      "forms": [
        {
          "id": "primary.irp",
          "type": "irp",
          "device": "0x00",
          "function": "0x11",
          "confidence": "plausible",
          "source": "irblaster-db@6aafd15 remote 7264, 'TV VOL -' 811 RC5: 12 bits, start bit inverted into F as RC5"
        }
      ]
    },
    "KEY_TV_VOL_PLUS": {
      "label": "TV VOL +",
      "forms": [
        {
          "id": "primary.irp",
          "type": "irp",
          "device": "0x00",
          "function": "0x10",
          "confidence": "plausible",
          "source": "irblaster-db@6aafd15 remote 7264, 'TV VOL +' 810 RC5: 12 bits, start bit inverted into F as RC5"
        }
      ]
    }
  }
}
