{
  "manufacturer": "CARREFOUR",
  "model": "IR Blaster DB 3478 (Panasonic)",
  "aliases": [],
  "controls": [
    "CARREFOUR | HFA 200 - 11",
    "CARREFOUR | HOME"
  ],
  "protocol": {
    "name": "Panasonic",
    "carrierHz": 37000,
    "minSends": 1
  },
  "keys": {
    "KEY_UNLABELED_400410AF00BF": {
      "label": "??",
      "forms": [
        {
          "id": "primary.irp",
          "type": "irp",
          "device": "0x08",
          "subdevice": "0xF5",
          "function": "0x00",
          "confidence": "plausible",
          "source": "irblaster-db@6aafd15 remote 3478, '??' 400410AF00BF REC80: 48 wire bits, bytes bit-reversed as Panasonic"
        }
      ]
    },
    "KEY_UNLABELED_400410AF209F": {
      "label": "??",
      "forms": [
        {
          "id": "primary.irp",
          "type": "irp",
          "device": "0x08",
          "subdevice": "0xF5",
          "function": "0x04",
          "confidence": "plausible",
          "source": "irblaster-db@6aafd15 remote 3478, '??' 400410AF209F REC80: 48 wire bits, bytes bit-reversed as Panasonic"
        }
      ]
    },
    "KEY_UNLABELED_400410AF70CF": {
      "label": "??",
      "forms": [
        {
          "id": "primary.irp",
          "type": "irp",
          "device": "0x08",
          "subdevice": "0xF5",
          "function": "0x0E",
          "confidence": "plausible",
          "source": "irblaster-db@6aafd15 remote 3478, '??' 400410AF70CF REC80: 48 wire bits, bytes bit-reversed as Panasonic"
        }
      ]
    },
    "KEY_UNLABELED_400410AF803F": {
      "label": "??",
      "forms": [
        {
          "id": "primary.irp",
          "type": "irp",
          "device": "0x08",
          "subdevice": "0xF5",
          "function": "0x01",
          "confidence": "plausible",
          "source": "irblaster-db@6aafd15 remote 3478, '??' 400410AF803F REC80: 48 wire bits, bytes bit-reversed as Panasonic"
        }
      ]
    },
    "KEY_UNLABELED_400410AF8837": {
      "label": "??",
      "forms": [
        {
          "id": "primary.irp",
          "type": "irp",
          "device": "0x08",
          "subdevice": "0xF5",
          "function": "0x11",
          "confidence": "plausible",
          "source": "irblaster-db@6aafd15 remote 3478, '??' 400410AF8837 REC80: 48 wire bits, bytes bit-reversed as Panasonic"
        }
      ]
    },
    "KEY_UNLABELED_400410AF902F": {
      "label": "??",
      "forms": [
        {
          "id": "primary.irp",
          "type": "irp",
          "device": "0x08",
          "subdevice": "0xF5",
          "function": "0x09",
          "confidence": "plausible",
          "source": "irblaster-db@6aafd15 remote 3478, '??' 400410AF902F REC80: 48 wire bits, bytes bit-reversed as Panasonic"
        }
      ]
    },
    "KEY_UNLABELED_400410AFB00F": {
      "label": "??",
      "forms": [
        {
          "id": "primary.irp",
          "type": "irp",
          "device": "0x08",
          "subdevice": "0xF5",
          "function": "0x0D",
          "confidence": "plausible",
          "source": "irblaster-db@6aafd15 remote 3478, '??' 400410AFB00F REC80: 48 wire bits, bytes bit-reversed as Panasonic"
        }
      ]
    },
    "KEY_UP": {
      "label": "UP",
      "forms": [
        {
          "id": "primary.irp",
          "type": "irp",
          "device": "0x08",
          "subdevice": "0xF5",
          "function": "0x02",
          "confidence": "plausible",
          "source": "irblaster-db@6aafd15 remote 3478, 'UP' 400410AF40FF REC80: 48 wire bits, bytes bit-reversed as Panasonic"
        }
      ]
    },
    "KEY_VOL_MINUS": {
      "label": "VOL-",
      "forms": [
        {
          "id": "primary.irp",
          "type": "irp",
          "device": "0x08",
          "subdevice": "0xF5",
          "function": "0x0C",
          "confidence": "plausible",
          "source": "irblaster-db@6aafd15 remote 3478, 'VOL-' 400410AF308F REC80: 48 wire bits, bytes bit-reversed as Panasonic"
        }
      ]
    },
    "KEY_VOL_PLUS": {
      "label": "VOL+",
      "forms": [
        {
          "id": "primary.irp",
          "type": "irp",
          "device": "0x08",
          "subdevice": "0xF5",
          "function": "0x0F",
          "confidence": "plausible",
          "source": "irblaster-db@6aafd15 remote 3478, 'VOL+' 400410AFF04F REC80: 48 wire bits, bytes bit-reversed as Panasonic"
        }
      ]
    }
  }
}
