{
  "manufacturer": "SONY",
  "model": "IR Blaster DB 144 (Sony15)",
  "aliases": [],
  "controls": [
    "SONY | DHC-AZ2D",
    "SONY | HCD-GNV111D",
    "SONY | HCD-GNV99D",
    "SONY | HCD-GNZ55D",
    "SONY | HCD-GNZ5D",
    "SONY | MHC-GN999D",
    "SONY | MHC-GN999DS",
    "SONY | MHC-GNZ55D",
    "SONY | MHC-GNZ5D",
    "SONY | MHC-GNZ77D",
    "SONY | MHC-GNZ7D",
    "SONY | MHC-GNZ88D",
    "SONY | MHC-GNZ8D",
    "SONY | MHC-GNZ9D",
    "SONY | MHC-WZ88D",
    "SONY | RM-AMU001"
  ],
  "protocol": {
    "name": "Sony15",
    "carrierHz": 40000,
    "minSends": 3
  },
  "keys": {
    "KEY_FUNCTION_MINUS": {
      "label": "FUNCTION-",
      "forms": [
        {
          "id": "primary.irp",
          "type": "irp",
          "device": "0x90",
          "function": "0x6A",
          "confidence": "plausible",
          "source": "irblaster-db@6aafd15 remote 144, 'FUNCTION-' 5612 SONY15: wire-order bits, first is MSB, pad bit 0 as Sony15"
        }
      ]
    },
    "KEY_FUNCTION_PLUS": {
      "label": "FUNCTION+",
      "forms": [
        {
          "id": "primary.irp",
          "type": "irp",
          "device": "0x90",
          "function": "0x69",
          "confidence": "plausible",
          "source": "irblaster-db@6aafd15 remote 144, 'FUNCTION+' 9612 SONY15: wire-order bits, first is MSB, pad bit 0 as Sony15"
        }
      ]
    },
    "KEY_KARAOKE_MODE": {
      "label": "KARAOKE MODE",
      "forms": [
        {
          "id": "primary.irp",
          "type": "irp",
          "device": "0x90",
          "function": "0x2A",
          "confidence": "plausible",
          "source": "irblaster-db@6aafd15 remote 144, 'KARAOKE MODE' 5412 SONY15: wire-order bits, first is MSB, pad bit 0 as Sony15"
        }
      ]
    },
    "KEY_KEY_B": {
      "label": "KEY b",
      "forms": [
        {
          "id": "primary.irp",
          "type": "irp",
          "device": "0x90",
          "function": "0x17",
          "confidence": "plausible",
          "source": "irblaster-db@6aafd15 remote 144, 'KEY b' E812 SONY15: wire-order bits, first is MSB, pad bit 0 as Sony15"
        }
      ]
    },
    "KEY_KEY_HASH": {
      "label": "key #",
      "forms": [
        {
          "id": "primary.irp",
          "type": "irp",
          "device": "0x90",
          "function": "0x16",
          "confidence": "plausible",
          "source": "irblaster-db@6aafd15 remote 144, 'key #' 6812 SONY15: wire-order bits, first is MSB, pad bit 0 as Sony15"
        }
      ]
    },
    "KEY_SOUND_FIELD": {
      "label": "SOUND FIELD",
      "forms": [
        {
          "id": "primary.irp",
          "type": "irp",
          "device": "0x90",
          "function": "0x6E",
          "confidence": "plausible",
          "source": "irblaster-db@6aafd15 remote 144, 'SOUND FIELD' 7612 SONY15: wire-order bits, first is MSB, pad bit 0 as Sony15"
        }
      ]
    }
  }
}
